1095955	how much grated cauliflower from a large head ear deformed tissue injury growth intestine
1095966	how much for bitcoin today
1095971	how much fiber is in valencia orange thread object structure rind reddish pulp orange berry
1095982	how much fat is in broccoli
571696	what are the monuments in washington dc curettage dilation
1095988	how much exercise should i get per day faculty repeated use
1095994	how much earnings required to file taxes
95286	commercial roaming definition
1096006	how much does uber make per year
1096021	how much does the average professional nba player make relating characteristic profession
1096025	how much does state pay nurses in md surgeon infirm physician maintaining practices health professional cares sick skilled supervised promoting dentist person is
1096044	how much does open heart surgery cost
1096045	how much does one roll of duck tape cost family neck bill plumage feet sexes duck Anatidae are birds webbed legs swimming tape fabric band
1096049	how much does nanny cost
1096065	how much does it cost to run for state representative
1096087	how much does it cost to go to colorado state university
1096118	how much does grimace
1096126	how much does fake teeth surgery cost
1096180	how much does a teacher get paid in nassau county
1096207	how much does a permit cost to climb mount everest
1096211	how much does a paddle boat part —called patient paddle placed shock chest defibrillator discharged electricity electrode is
1096227	how much does a job posting cost linkedin
571954	what are the names of timmy turner's parents back X including associated Y coarctation chromosome skin neck presence condition onset absence hairline stature characteristics is phenotype valgus cubitus ovaries determined
1096252	how much does a bar of gold worth
1096256	how much does a average nfl player make
1096258	average price of farmland nebraska
1096262	how much do you make at tesla weber meter mks square system density unit flux
1096268	how much do we owe china
47716	average yield per strawberry plant
1096311	how much do krispy kreme doughnut holes a dozen cost
1096347	average persons tapscan
1096357	how much did nra give to congress
1096360	how much did made star trek beyond gross 
1096368	how much did apollo astronauts get paid
1096371	how much debt does china have as % of gdp made activity returns develops periods bodily be rest body deficit metabolism oxygen
1096375	how much data analyst makes
1096376	how much damage harvey Harvey relating commemorating William
1096401	how much can you get per year for pell grant
1096425	how much budget was given for the wall
1096429	how much bitcoins are there in the world
1096431	how much beef is eaten in the us food chew ingest turn take mouth swallow
1096454	how much apple cider vinegar is needed to help clear sinus body hollow cavity beer obtained liquids dilute alcohol condiment liquid fermentation cider distilled fermented wine is used
1096457	how much a square foot does it cost to have carpet installed
1096463	how many years to go to mars
1096475	how many years of college do you need to be a park ranger
1096476	how many years must a person be a u.s. citizen before they can be senator
1096479	average pay for home health care provider in joplin missouri ppo
1096493	how many years does a state senator elected
1096498	how many years do we vote for us senators
1096509	how many years back to the clinton tax returns go
1096516	how many words for an introduction manuscript putting action inserting
1096527	how many weeks should you give puppies away
1096532	how many weeks is best to do gender ultrasound sex vibrations nature sound hearing frequencies range
1096533	average oxygen level
1096541	how many wastewater treatment plants in us
1096543	how many warheads does a peacekeeper have
1096551	how many valence electrons does an atom of the element neon (ne) have? combination element particle exist × having charge rest gram proton electricity consisting mass coulomb particle power degree element shown combine be weights hydrogen number weight compared combining substituted —symbol element air found lamps Ne amounts minute colorless used
572286	what are the parts of a cell and how do they work
1096605	how many teams are in the nba today
1096607	how many tablespoons in one fourth cup? nerve
1096610	how many tables can sql server join fixed examining operating consisting furniture slab piece legs used
1096619	how many sunflower seeds are in one sunflower blossom
1096620	how many subscribers does the ny times have?
1096628	how many students at mount vernon middle school fortville life age years period
1096641	how many states have coastlines that touch the gulf of mexico part sense understand contact feel intent perceive handle appreciate bring reported rash memory veterans Persian cause been has including fatigue war fought Gulf syndrome loss pain headache
1096656	how many square feet does a student need?
1096658	how many sq feet in a sq of vinyl siding? atom ethylene removal derived hydrogen CH2=CH
1096694	average lifespan of crocodiles in captivity existence duration individual
1096712	how many reps does missouri have
1096739	how many pounds of fat can you lose in a week weight mass units
1096776	how many percent of people worldwide have vitiligo leukoderma marked disorder destruction skin form spots melanocytes is caused
1096787	how many people were killed atbernburg, brandenburg, grafeneck, hadamar, hartheim, hadamar, and sonnenstein inactivated virus been has being chemicals containing is
1096788	how many people were injured in the las vegas shooting hurt inflict characterized sensations piercing
1096794	average kilowatt cost in alabama
1096823	how many people died in the parkland school shooting characterized sensations piercing
1096827	how many people died from the flu who didn't take the vaccine influenza
1096830	how many people die yearly from cars
1096840	how many people can sit in a car at sci fye theater disney assemblies demonstrations lectures tiers rising room seats
1096850	how many patients does texas oncology see? study cancer treatment prevention concerned medicine branch diagnosis surgeon awaiting care treatment physician individual
1096855	how many pages is the coquette
1096866	how many oz in a lb?
1096870	how many ounces in dunkin donuts iced coffee medium effecting means conveying something
1096886	how many net carbs in tsp of sugar
1096887	how many nba championships did the suns win
1096911	average income for a flight engineer
1096932	how many miles has pastor arthur blessitt ever walked?
1096943	how many miles across is montana
1096944	how many microns thick is house paint? composed types making myofibrils angstroms myofilament width protein nanometers myosin is —called meter millionth mu unit length
1096945	how many microns is an anthrax spore characterized lungs bacterium handling sheep disease products anthrax causing humans hair lesions animals Bacillus cattle caused nodules —called meter millionth mu unit length fungi microorganisms produced spore body developing plants fusion dormant individual
1096947	how many microgram in a milligram gram millionth —abbreviation thousandth mg
1096958	how many members in the iaca body part organ
1096964	how many medical schools in south korea
1096983	how many lieutenant colonels in us army
1096998	how many kids does jack osbourne have seeds having Canavalia plant grown C. forage genus pods
1097014	how many iron atoms are in the formula for iron(iii) oxide? combination element particle exist
1097023	how many inches are in a yard and what is
1097027	how many humans have tigers killed?
1097069	average gas costs in kentucky
1097087	how many grams per pint
1097093	average fulfillment cost per order gratification desire dreams fantasies
1097100	how many grams of fiber does applesauce have thread object structure
1097118	how many glucerna shakes can i drink a day delirium trembling tremens condition
1097119	how many glasses of water is required a day cools condition substance silica stabilizer mixture phosphates fusion boron consisting mass borates formed crystallization flux oxides phosphorus silicates
1097135	how many gallons of gas in a chevy cruze
1097153	how many feet from a fire hydr
1097154	how many feet from a fire
1097195	how many electrons and protons and neutrons in gold? nuclei proton known hydrogen nucleus has mass is particle × having charge rest gram proton electricity consisting mass coulomb particle atom neutrons nuclei charge gram hydrogen nucleus electron has mass carries constituent is particle
1097198	how many eggs do rouen ducks lay a year family neck bill plumage feet sexes duck Anatidae are birds webbed legs swimming
313940	how much does general anesthesia cost sensation nerve loss passage administration impulses pathways brain consciousness block produced is pain agents
1097213	how many dna bases are in your body part structure organ portion attached is organism
1097223	how many digits account number wells fargo phalanges number including nail tip limbs bearing toe reduced be hoof humans divisions have vertebrates series terminate are finger amphibians claw horse
1097242	abid cardiology diseases action heart study
310853	how much does a pharmacy tech make? practice preserving preparing art drugs dispensing profession compounding 
1097294	average days in inventory turnover personality index interests traits designed questionnaire provide replacement cell process system tissue living constituent neurotransmitter loss
1097298	how many cylinder have the jeep cherokee limited nature limited definite running course axon neuron
1097304	how many cups is two tablespoons having stem drinking vessel handle lid base sometimes
1097314	how many cubs do polar bears give birth to poles relating body give birth
1097317	how many cruel intentions movies are there determination way act
835206	what is the name of the guy who plays firestorm on the flash rush
1097359	how many chromosomes can be seen in a normal human karyotype cell representation characteristics chromosomes perceive eye
1097373	how many children are identified with autism according to the cdc specimen determine position —called appears form ability others activities communicate recognized focus diagnosed relationships impairment ones age expression exhibited is preoccupation patterns disorder behavior date confinement
310948	how much does a polar bear liver weigh poles relating body
1097386	how many categories of coverage on a homeowners policy
1097438	how many calories per gram are in fats greasy matter cells tissue consisting distended chiefly kilogram water centimeter g mass density unit —abbreviation
573157	what are the restrictions on a california provisional license breaking DNA fragments enzymes restriction
1097448	how many calories in slim fast shakes AIDS stages body wasting delirium trembling tremens condition
1097449	how many calories in provolone cheese
1097461	how many calories in cooked roast beef lean
1097469	how many calories in a salad containing chicken apples and walnuts family fruit pome Malus rounded rose apple tree jumble observed schizophrenia speech
1097492	average cost of stomach staple hold U-shaped fastener layers closure tissue incision used
311067	how much does a professional swimmer make trapped Pseudomonas ear swimming Staphylococcus pain characterized discharge bacterium itching outer occurs aureus canal aeruginosa swelling loss is inflammation water redness becomes fungus infected relating characteristic profession
1097508	how many calories are in one egg liquid
1097523	how many burn centers are in the usa having function —called cells group center nerve
1097537	how many boarding groups does american airlines have having number individuals relationship assembled
1056742	what is detox treatment
48998	bash meanong
1097585	how many americans are victims of workplace violence each year?
1097602	how many alcohol in malibu rum
835478	what is the name of the poes where frog breath through suborder tailless leaping amphibians Diplasiocoela faculty breathing
1097674	how long to wait for dental implant after tooth extraction extracting something process act food borne mastication prehension are jaws appendages serve bony set patterns consciousness habit
1097721	how long to keep cpe records treatments patient history taken received results diagnoses care information medications test record
573452	what are the siamese twins? twins pair
1097746	how long to evict tenant in missouri
1097786	how long to bake baked potato?
1097796	how long take tylenol codeine to get out system cough phosphate reliever found C18H21NO3·H3PO4 sulfate derivative action form suppressant morphine C18H21NO3 opium pain chiefly is used
49234	bay rum scent compartment care hospital place ship used
1005907	which battle marked the turning point of the civil war? twisting injure wrenching incisor eleventh incisors surface obliterated age wearing animal crown becomes remain disappears year hollow traces is therefore horse
1097894	how long lsd last in urine
1097905	average closing costs in florida for seller
1097906	how long is your insurance good for once you are terminated
1097909	how long is treatment for a vaginal yeast infection relating vagina resembling
1097937	how long is the chinese wall
1097979	how long is a whale
1097995	how long is a dogs heat cycle
1097999	how long is a chinese visa valid
1098010	how long has steven gerrard been with liverpool for
49435	beard define man excluding mustache grows hair face
1098013	how long has most life on earth been around
1098044	how long for chlorine to leave water illness absence work permitted water oxidizing agent element Cl halogen bleach gas disinfectant purification isolated odor —symbol is used
1098048	how long for an eye twitch to go away undergo contraction
1098071	how long does uscis take to respond to rfe react response
1098090	how long does the cough last after bronchiolitis lungs air noise efforts expel series bronchioles inflammation
1098101	how long does radiation treatment side effects last
1098102	how long does priority mail take to get delivered parturient female assist birth giving
1098110	how long does norovirus last on surfaces strains dogs RNA includes species Norwalk virus causing people cows animals viruses gastroenteritis genus body boundary object exterior
1098111	how long does nicotine stay in your blood stream for testing insecticide aids smoking cessation C10H14N2 tobacco alkaloid principle is used fluid flow gas water
1098169	how long does it take to get pmi applications approvals applying act
1098180	how long does it take to get an mri result procedure imaging resonance is used
1098182	how long does it take to get a receipt notice from uscis for premium
1098222	how long does it take for the moon to do a full circle around earth is curve point plane
1098226	how long does it take for sun to rotate spf
1098236	average age for baby to start walking walk ambulatory
573954	what are the steps to a waltz dance sydenham chorea
1098249	how long does it take for opiates to clear from urine sleep induce drug addiction block system acts associated pain euphoria dependence calmness tract respiration codeine opium cell morphine sedation is produce tolerance contains repeated derived prolonged binds receptors use
1098276	how long does it take for bruised spleen to go away flattened capsule storage organization denser role production system enclosed consisting masses end associated trabeculae object blood pulp cells consistency organ circulatory purplish tissue interstices fragile ductless plays chiefly ramify lymphocytes stomach connection lying destruction humans vertebrates is condensed resembles filtration arteries gland supply
1098284	how long does it take for an apple to decompose r roentgen
574002	what are the stress hormones in the body product blood activity produces fluids distance cells effect circulates body point living synthesis
1098322	how long does it take a credit card to report
1098338	how long does hamburger stay good in fridge
1098354	how long does egg salad keep in refrigerator jumble observed schizophrenia speech
1098355	how long does dressing last in freezer applied gauze covering ointment lesion
1098422	how long does a blood glucose test last occurs nature carbohydrate has group C6H12O6 form assimilated carbonyl sugar animals colorless is
1098440	how long do you keep flag at half mast half having blood being United versicolor Iris used rhizomes States virginica irises I. trousers antishock
1098452	how long do you have to brush your teeth absorption kidney membrane specialized cell stria microvilli is tubule
1098481	aultman orrville
1098497	how long do resin countertops last water brown plant substances are ether secretions formed solvents nonconductors
1098510	how long do international wires take to process? surgery thread dentistry position bone metal suture teeth rod tissue transfix used fractured kelvin kilogram having International meter deriving candela based system mole SI—called units —abbreviation System base
1098520	how long do i grill salmon in foil? food bacteria salicin form genus septicemia family poisoning animals sucrose media carbohydrates humans cause grow inflammation lactose are gas fever Enterobacteriaceae acid
1098523	how long do i boil potatoes infection having —called follicle core skin tissue furuncle pus resulting forming swelling hair inflammation
1098536	audible phone number customer service being heard
1098556	how long did the revolutionary war take place
1098561	how long did rome rule the western world Lyme —called disease tick found genus vector U.S. diseases British Columbia is pacificus I. Ixodes H2S chemical element chemistry valence +6 H2SO4 given —2 sulfur sum rule is value
1098570	how long did barack obama be president
1098600	how long can you leave raw chicken in your fridge illness absence work permitted
1098608	how long can you freeze chuck roast ice hardened loss heat become
1098609	how long can you be in jail for selling drugs for someone substance medication used preparation typhus
1098641	how long can ribs stay frozen cartilages pairs articulated column end bony walls body include mammals occur humans rods sternum connected vertebrates viscera protect region are stiffen
1098646	how long can it take to heal a peptic ulcer disintegration surface membrane break skin tissue necrosis loss pus relating digestion digestive promoting
1098698	how long between the birth of each kitten does it take
1098719	how long are you contagious with a stomach bug contact spider creeping insect —not crawling animal used
1098725	how long are the days on venus
1098763	how long after ovulation does it take for implantation state act implanting being implanted process discharge ovum mature
1098765	how long after menstruation is ovulation represent readjustment following females human blood ovulation period tissue state discharging accompanying age primate intervals breeding is preceding changes recurs debris secretions considered uterus discharge ovum mature
836640	what is the normal heart rate chart patient sheet information form giving record
1098787	how late can males receive hpv vaccine type diabetes papillomavirus spermatozoa produces gametes eggs female fertilize sperm individual
312368	how much does amazon get for ebooks
1098802	how is the weather in barcelona spain
1098804	at what temperature does hypothermia set in fahrenheit body temperature
1098809	how is the gem painite made
574547	what are the three branches of the state government? something enters body source extends
1098846	how is rose quartz used etc crystals silica occurs colored SiO2 consisting masses crystalline transparent colorless oil family pinnate shrubs leaves flowers are Rosaceae sources rose genus Rosa
574569	what are the three different parts of a nucleotide purine phosphate deoxyribose RNA DNA compounds group are consist joined sugar ribose units base
1098860	how is page yield calculated for ink cartridge
1098874	how is influenza treated? disease acute orthomyxoviruses caused
1098895	how is gold used in science
1098905	how is delaware sales tax calculated
1098909	how is cranial neuropathy diagnosed skull relating cranium shooting system damage toxins pain dysfunction nerves marked weakness drugs deficiency atrophy syndrome numbness caused muscle condition tingling burning is infection Guillain-Barré disease injury signs recognize disease symptoms
1098927	how is a pre existing condition determined pets occurrence appearance requirement something time point existing obtain quantity magnitude character information location regard
1098967	how fast does stomach flu come on influenza
836832	what is the normal range for urine sodium
1099050	how far in advance to send invitations birthday party life donation competent order termination make document becomes living guidance decisions event provide person support signed
1099065	how far deep to plant beet early wonder
1099072	how far back do employment background checks
1099084	how expensive is sydney
1099099	how early can you show signs of morning sickness? interferes drug egg taken inhibiting blocking implantation ovulation doses intercourse estrogen days containing uterus pregnancy
1099108	how does your dna fit inside of your cells? disease marked violent attack unconsciousness epilepsy paroxysm convulsions
1099178	how does sperm develop fluid male impregnating semen promote make growth
1099189	how does rational choice theory predict antiabortion having understanding reason
1099217	how does heart work
1099219	how does guaifenesin work in the body
1099226	astringent define
574944	what are the toronto tiff dates september
1099244	assonance meaning
1099284	how does a scientific inquiry begin
1099288	how does a propeller create thrust persistent incisors thrusting abnormalities tongue swallowing lead act childhood
1099290	how does a hydrate differ from an anhydrate Glauber water substance salt union formed compound food dehydrate processing
1099321	aspen dental corporate telephone number
1099340	how do you call a rapid response in the hospital? sleep —called REM movement eyes associated activity parts resulting stimulation inhibition organism
1099342	how do wrinkle fillers work furrow age ridge skin fatigue worry
837202	what is the nutritional value of oatmeal food nourished animal plant processes act substances nourishing sum being takes process radiation substance passing absorbing thickness intensity reduce
1099351	how do utis happen
1099368	how do spirits manifest themselves recalled dreamer psychoanalysis content dream is water mash alcohol liquid is distilled —often containing distillate used
575096	what are the two largest climate regions in canada? is body parts subdivisions
1099391	how do plasma membranes work part blood milk material lymph suspended distinguished is sheet plant animal origin layer
575146	what are the two major parts of the nervous system neurons relating composed
1099451	as scarce as hen's teeth meaning
1099452	how do duty based ethical standards differ from outcome-based ethical standards? extent quality established something quantity weight authority measure set rule value person order be protect care harm use duty exercised others risk standards accepted conduct conforming
1099456	how do diatoms reproduce? diatomite form skeletons Bacillariophyceae algae minute class
50891	benefits of hydrogenated water combine hydrogen expose treat add compound unsaturated molecule
1099482	how do active transport and passive transport differ reacting acting way lethargic lacking energy
1099488	a scar meaning mark left skin tissue healing
1099530	artist who painted the famous thanksgiving pic
575268	what are the two varieties of cells ranking species groups plants animals subspecies
1099595	how did alexander graham bell create a phone tension technique body moving positioning believed is reduce decibels —abbreviation b
837476	what is the oldest dog in the world?
1099626	how can you tell the difference between a wart and a mole on your face mark protuberance body nevus spot genotypes papillomavirus proliferation produced skin extremities papillae projection caused part chin forehead including eyes cheeks mouth head
1099632	how can nitrogen be fixed odorless form antibiotics tasteless element proteins volume cells comprising dyes atmosphere acids fertilizers substances percent N hence living alkaloids colorless is cyanides compounds gas constituent —symbol make firm
1099636	how can deforestation directly affect living organisms life activities function means constituted living organs being carry individual
1099653	how big is slovakia
1099656	how big is magic kingdom in acres substance bacteria remedy disease side destroying cells cancer therapy providing effects condition agents divisions are objects grouped
1099670	how big can leopard tortoises get
575407	what are the u.s. senate responsibilities
1099700	how are meiosis and mitosis similar? apex prophase results steps number consisting chromosomes parent having nucleus formation place takes process involves nuclei metaphase cell series anaphase dividing telophase end structure involves reduced reduction half results cells division pair number cell passes chromosomes being process daughter
1099706	how are internal and external fertilization differ making process act being perceived something surface limits situated existing
1099729	houston methodist main phone number —called semilunar transverse transversalis rectum recti folds
