463133	negative pressure definition refusal marked prohibition
897476	what state has the easiest bar exam examination
373209	how to present a project charter manifest show
635497	what does d.o. mean after a doctors name
635626	what does dead lifting work surgery sagging —called remove typical rhytidectomy plastic skin imperfections defects aging neck wrinkles face life having died deprived
897789	what state is legal for marijuana
635647	what does debt to gdp ratio tell us made activity returns develops periods bodily be rest body deficit metabolism oxygen
897910	what state is rhode island
897953	what state is st. cloud in
635823	what does derogatory mean
897981	what state is the city evergreen
111723	could i catch mrsa from a lady whose leg is weeping? limb supporting animal walking body used lungs bacterium strains infections blood penicillin hospitalized immunocompromised bone cause membranes are skin individuals live Staphylococcus antibiotics methicillin
630318	what does a snake bite mean in a dream? enter seize teeth jaws wound grip glands tapering reptiles suborder Serpentes Ophidia fangs modified body injected limbless venom scaled is produce grooved
636188	what does dol neg grant stand for
280796	how many days are in three years
111995	cours definition
112035	courtesy of meaning
280825	how many days at dollywood
761425	what is it called when you make up illnesses sickness body mind condition
1094863	how to pronounce jai
636434	what does duty cycle mean for viair air compressor person order be protect care harm use duty exercised others risk compresses
636437	what does dv stand for in psychology mind science behavior value
898686	what stations take grit tv? positioned assigned remain place someone is
898714	what std code is 01764 transmitted disease
112318	crate engine how heavy chains comprising polypeptide antibodies
149801	different kind of kidney stones
112477	creative arts definition
374690	how to reach jamnagar to somnath temple space mammals side forehead humans
636853	what does enclave means
636929	what does enterprise mean by dw water
374799	how to read latitude and longitude with minutes understand lipreading time hour part degree
636949	what does eobr means
112718	crew fort worth application midface fracture region maxilla bones applying act
717845	what is andrea tantaros doing
899212	what structure are located in the abdominal  cavity? affecting belonging abdomen pattern part arranged something organization
637208	what does excel isna mean
637234	what does exempt or non-exempt employee mean
899423	what structures in the cell membrane function as ion channels? atom gained having charge lost result electrons group carries atoms pattern part arranged something organization sheet plant animal origin layer
18840	another name for reaper
375291	how to reduce swelling of non painful tonsils giving pain feeling —called pillars capsule throat diffuse lymph masses anterior fauces lie grouped tissue pair covered surface side follicles epithelium is surrounded tonsil composed crypts are c B hepatitis A viruses caused displaced fracture parts mass bringing correct positions
929046	what years were total eclipses in the past intends side hand point finger test object
637459	what does fdg mean
899800	what supplements are antiinflammatory inflammation counteracting reducing makes addition completes something
899869	what supplies blood to the heart muscle
900062	what symmetry are marine flatworm in phylum Platyhelminthes platyhelminth worm size axis correspondence line parts shape center plane sides position
900076	what symptoms and causes of fatty liver corpulent stout
900077	what symptoms are associated with black mold substance cavity shaped fluid is
113664	curious definition synonyms
113732	current assets / current liabilities
375891	how to remove cat allergens from house mammal rats pet domesticated mice catus kept Felis catching induces allergy substance
900450	what tcm means
900599	what team does will johnson play for conjunctivitis drug results following esophagus lesions form damage characterized leading membranes skin genitalia anus multiforme mouth occurs reaction cause blindness is has purulent illness
638503	what does gross mean? 
900696	what team was shelton benjamin a part of wwe
900731	what teams send out playoff tickets before the season
376537	how to remove wrinkles from upper lip lip articulations margin exposed membrane surround set mouth takes speech humans fleshy organs vertebrates folds composed pinkish opening are tooth denture furrow age ridge skin fatigue worry
638723	what does hazardous constituents means
900924	what temp do you cook pork chops on in the oven? and for how long? infests pork genus solium Taenia cysticercus contracted humans intestine ingestion adult cooked tapeworm T. is swine larva develops has
638795	what does heat engine mean
114573	customer service number for atmos energy
114633	cuyahoga county csea phone number
114638	cva causes
638928	what does hiit workout mean
849245	what is the sunset strip vein means remove stripper
639084	what does hortensia mean in english
313262	how much does braces cost ? ligaments back paralysis appliance strained bone parts gives support muscles
639163	what does humus do to soil? matter brown material plant decomposition portion resulting forming soil
901355	what temp to roast brussel sprouts send produce sprouts growth
639412	what does image mean counterpart lens device produced mirror object
639545	what does increment of added gained something
639560	what does indentured servants mean
115365	danny phantom the ultimate enemy game model body parts
674595	what is a bezoar in terraria —called calculi found bezoar ruminants stone organs
1086248	what causes a prickly itchy feeling all over eruption —called rash tingling heat ducts sweat pimples itching caused inflammation contains senses sensations touch skin are organs end temperature
377805	how to rig for crappie
115704	david tepper net worth
640103	what does it cost to paint a house
115833	days sales in cash ratio definition
412532	is hsa account taxable serum albumin
115930	dcu routing number'
640232	what does it mean by the right to redress
47513	average winter temperature in kent co. delaware
902657	what term means a heart attack
79763	can you spray roundup after it rains medicated part charge jet air deodorant application vapor liquid disinfectant room used
902855	what test are relvant for heart screenings
116431	deed restrictions breaking DNA fragments enzymes restriction
116455	deep listening definition
1067990	why does stomach feel crampy?
902919	what test is done for triglycerides —called blood lipoproteins circulate esters group are form tissue molecules glycerol formed lipids acids molecule fat
902931	what test is for lupus
116517	deepest voice ever extending outer surface
1024312	who are the months named after
309402	how much does a engineer
893271	what settings do i go to scan a picture to my pc percent percentage radiation device photometer sensing beam examine
903235	what the average temp in tampa fl in october
116820	deferred action literal definition agent force results effect capacity bringing exerting process
849596	what is the synonym for prudent
641156	what does it mean when someone sign a document under duress language gestures represent set used
955359	when to do amniocentesis insertion needle wall obtain female fluid sex chromosomes hollow determination uterus abnormality examine
116939	define  simplify math
237945	how is war different today
641284	what does it mean when you dream about babies sleep images emotions REM thoughts occurring series
641293	what does it mean when you dream of chewing on gum? sleep images emotions REM thoughts occurring series
117036	define a multichannel radio induced radio relating using frequencies
903479	what the hell is salad fingers hand digit forelimb members thumb terminating jumble observed schizophrenia speech
117113	define abraham lincoln during civil war
379337	how to set password before purchasing on apple
641583	what does it mean when your tongue is all white food functions end covering hyoid organ attached mouth base process speech muscle attaching glands taking structure move floor swallowing consists organs is bone relation parts mass
641618	what does it mean your body in ketosis increase reduced diabetes metabolism body mellitus conditions disturbed bodies
903811	what the watermelon parts are called
980789	where is crystal colorado faces chemical element plane mixture repeating has body formed compound arrangement is atoms solidification
904007	what those pending mean
117683	define anglicised
980811	where is csf reabsorbed into the blood factor
117728	define anomaly part deviation
642032	what does kusum mean
194430	george lucas entrepreneur
642352	what does liberal arts consist of
904542	what time does sams pharmacy open practice preserving preparing art drugs dispensing profession compounding
1100639	fastest anyone has run across usa
904727	what time does walmart pharmacy open? practice preserving preparing art drugs dispensing profession compounding
118365	define biobanks
118457	define bona fides
380755	how to spray baste a large quilt on a table medicated part charge jet air deodorant application vapor liquid disinfectant room used intestine
905057	what time is it pdt?
905479	what time was earthquake in alaska?
119089	define cleft fissure opening parts resulting failure development fuse
119168	define coherent
905604	what time zone is crown point, indiana in skull part head
643561	what does modern time mean
905707	what time zone is jackson hole wy
643572	what does modulus mean expresses substance degree elasticity coefficient body possesses property
905766	what time zone is nashville in
119534	define coordinate in math condition bring movement action
119683	define credential
906126	what to call a graduation speech words expression thoughts communication
644023	what does nasa say about why we have moon phases cycle state appearance changes recurring
119761	define crusades
194724	gesundheit meaning
544260	weather in fort lauderdale today midface fracture region maxilla bones
119975	define debug
1068584	what is a purchase order definition
906692	what to do in seattle on memorial day
644658	what does ofii stand for
833268	what is the monthly cost of hulu
644746	what does op-ed mean
824542	what is the height of a bus something position distance chosen being body point bottom top standing
907046	what to drink besides water to keep you hydrated water combine elements cause take
907127	what to eat and drink to help lose belly fat abdomen
645024	what does oxygen and hydrogen make simplest element odorless elements H gas —symbol colorless is
645252	what does pbr322 do
121017	define engineering controls incorporate controls
121023	define enquires
38946	average money market interest rates
645343	what does pending transaction mean
907538	what to expect with alcohol withdrawal
1095165	how old is ricki lander?
645472	what does pfb stand for in medical terms
645604	what does phyto mean
850361	what is the temperature in washington
907997	what to serve with crab cakes flattened carapace limbs abdomen antennae curls grasping crustaceans body modified Brachyura pincers marine pair chiefly tribe
645892	what does population density quantity volume unit area length
908069	what to take for ibs constipation bowel syndrome
908154	what to use if fallopian tubes has fluid having move flowing change mass yield separation pressure particles position slender duct plant channel body animal discovered relating Fallopius
646071	what does preferred provider organization stand for ppo ppo
908237	what to use to take rust out of clothes moist composed attacked hydrated air iron oxide coating formed brittle
908316	what to wear to a graduation
646179	what does pro forma mean prolyl proline
908489	what tool to use to take off lambs tails body end process animal prolongation
646354	what does provisioning a modem mean
384406	how to unlock duty roulette person order be protect care harm use duty exercised others risk
646623	what does raci stand for?
564707	what are several methods of escape used by cephalopods attaining procedure object process means escape something find relief avoid
122440	define humidors
831815	what is the meaning of the term erythrocytes cell blood
122582	define imperiously
719488	what is archway publishing
122639	define incision and drainage surgery made body tissue wound cut drawing gravity means fluids suction cavity act wound process
909111	what transport molecule transports oxygen substance composed properties retains atoms is particle place convey transfer
384845	how to use a selfie stick form balm —used
909176	what treatments are available for addicted individuals manner action patient treating someone addiction cause
122807	define insouciantly
384985	how to use asa documentation aspirin
647260	what does rough trade mean bacteria capsule form being chains made having marked decrease broken formation organisms filaments forming strains surface —used tend virulence colonies one device composed traversed bar
909547	what tv series theme song was woke up this morning? events coming things number succession spatial class
20520	arbitrage definition
647503	what does sbp mean
647687	what does semen consist of spermatozoa glands tract Cowper suspended fluid consisting secretions prostate
680490	what is a dda account balance instrument weighing
909886	what two things make up cell membrane perceive eye sheet plant animal origin layer
385652	how to use stall bars metal denture parts piece connects
123529	define lupus
647872	what does shortcut mean
647876	what does shoulder mdi mean part trunk covering body joints tissue connected formed bones arm is inhaler
647949	what does simple diffusion mean intermingle liquids result move agitation region caused substances movement concentration solids gases process particles
123710	define marmite
910150	what type of account is valuation allowance Board recommended Sciences amount National vitamin Nutrition Academy —abbreviation nutriment RDA Food mineral is consumption
648049	what does slough mean ulcer tissue mass living separating
648119	what does sni mean
123859	define memorandum of understanding
798469	what is special about starfish form ketamine used
910375	what type of automatic transmission does the ferrari f430 come in transmitting instance process act
123975	define mib
124128	define mni
910622	what type of bond occurs when an atom shares one or more pairs of electrons with another atom? combination element particle exist × having charge rest gram proton electricity consisting mass coulomb particle holding pairs RNA bases hydrogen strands linked pyrimidine strand bonds consist ladder include cytosine guanine joined DNA rungs purine uracil thymine acid
910777	what type of business is walmart
910818	what type of cancer did jim kelly have
910870	what type of car was ms sally in cars millisecond
386653	how to write a mystery novel
124534	define nfc technology
545052	weather in mazatlan mexico
648877	what does sweeping mean in pregnancy
911032	what type of chemical bond is found between paired bases of the dna double helix made conflicting predicament response be messages receives allow person source rim ear pairs words member evokes items digits syllables learning recall pair part structure organ portion attached is organism
911056	what type of chinese is spoken in shanghai
588775	what causes humans make to the water cycle
124787	define oppress
649110	what does tear himself away mean moisten eye eyelids fluid diffused parts facilitate drop gland secreted saline motion
649200	what does terrorism mean and example
492988	saptco bus schedule procedure sequence step program indicates regimen plan
649294	what does the abbreviation cc mean in an email centimeter
562821	what are overpacks used for in hazardous material —called contrast agent surrounding suspension visualization blood tract material sulfate introduced body tissue X-rays vessels part swallowing kidneys is solution substance injection iodine barium
64528	can anyone take prenatal vitamins? performed existing birth occurring used
257309	how long does it take to get your bsrn if you already have a bachelors degree
649451	what does the atkins diet consist of carbohydrates program protein intake emphasizes restriction loss
911605	what type of doctor does eye exams examination
108287	cost per person for ptsd treatment disorder stress
588888	what causes increased alkaline phosphatase level hydrolysis phosphate groups esters transfer compounds accelerates acid enzyme synthesis having pH properties metal basic alkali relating containing solution
387603	how was reagans foreign policy designed to bring the cold was to an end introduced body living situation occurring
649763	what does the chief administrator do glands stomach lumen cells line
387662	how was the black death plague treated deal means care rate disease mortality pestilence causing
125545	define populace
649893	what does the constitutional protection of due process mean?? spf taken walk health
125627	define precocious puberty occurrence development condition primates menstruation marked occurrence becoming humans female period sex organs maturing being development characteristics reproducing
865384	what it is mri procedure imaging resonance is used
387848	how was the radar used
125705	define preventive drug disease something prevent used
387864	how was the second great awakening similar to the first dotage
650076	what does the egyptian plover
912234	what type of fire extinguisher is best for electrical equipment relating electricity operated conditioned extinction cause response
125842	define prolia
125898	define prosthetic device being relating prosthetics prosthesis
125996	define pull the wool over someone's eyes lanolin refining grease extract
650378	what does the greek word kai mean
650462	what does the idiom off the wall mean
850919	what is the the sedition act
388465	how wide must a hallway be broad-spectrum
388588	how working parents can stay involved when they have toddlers involves attention memory storing period focusing information manipulating seconds time
912879	what type of infection can you get from broken skin having subjected fracture been undergone
912898	what type of infections causes protozoan fungi state establishment bacteria microorganisms produced body protozoans viruses host agents protist phylum Protozoa subkingdom
126491	define resit
126525	define retrogressed
912961	what type of insurance is humana supplemental supplement serving
912992	what type of isolation for bacterial meningitis action isolating isolated being condition relating bacteria caused designated meningococcus mater Haemophilus bacterium Coxsackieviruses marked pia serotype meninges caused Neisseria virus arachnoid is inflammation disease B meningitides illness influenzae
913098	what type of layers make curly hair look thicker course lying thickness laid
913137	what type of lever is a tree
913286	what type of meals to eat for morning sickness interferes drug egg taken inhibiting blocking implantation ovulation doses intercourse estrogen days containing uterus pregnancy being health ill condition food taken portion satisfy time appetite
651187	what does the name brunhilde mean
913374	what type of mental problems can a stroke cause? mind response reality relating individual sensation —called consciousness damage obstruction accident blood tissue rupture caused impairment clot brain attack accompanied is loss motion supplying vessel
913509	what type of muscle contains actin and myosin actomyosin maintenance found comprising myofibrils protein cell movement shape contraction microfilaments
127098	define sim card
389258	hughes federal routing number syndrome
913568	what type of music is disturbed considered disability having experiencing disturbance illness exhibiting agitation
913579	what type of music is stevie wonder
1098953	how heavy are road bikes chains comprising polypeptide antibodies
632726	what does awesome cleaner clean pollution dirt pollution dirt
389385	human symptoms of bird flu influenza birds strains H5N1 Asia infections influenza orthomyxovirus produced epidemics subtype associated have caused
127315	define spalting
850957	what is the theme song
938773	when did grubhub start up
127682	define subtropical
977467	where is avril lavigne from?
914321	what type of rna carries the information that specifies a protein? activities chemical —called contain acid are control components associated acids
914368	what type of rock is diorite
914406	what type of rock is the mantle made of covers envelops enfolds something
127984	define tension stress degree stretching act stretched action being stiffness condition
914545	what type of shelter does a roadrunner live in
128158	define the role of an entrepreneur
128166	define the social welfare services groups organized assistance work
128178	define the term codon part —called amino sequence code specifies acid protein stops starts triplet nucleotides is synthesis
128200	define the term globalization as it applies in agribusiness management
914637	what type of solution is made when mixing table salt to water until it dissolves dissolution substance —called act gas liquid process is
1026258	who developed the first photograph promote make growth
652556	what does the pythagorean theorem do
914707	what type of stent is innova holding gauze something mold immobilized stent sutures formed place pad compound graft used
914771	what type of substance minimizes the changes in h+ and oh- in a solution. made existence something material has discrete is
390484	ibuprofen what is it used for drug symptoms C13H18O2 prescription fever relieve preparations strength arthritis used pain
1086675	what are thomas jefferson's kids named U metal end bottom traction sides extending crosspiece fractures applied splint consists leg ring is shafts limb fit arm
807845	what is the basis of india's caste system function parts foundation
178859	effects of oxygen deprivation removing removal well-being something act resulting process condition
652912	what does the sun symbolize spf
128633	define unadjusted trial balance experiment usefulness tryout test quality value instrument weighing
390813	iceland average monthly temperatures food regions islandica Cetraria C. lichen medicine genus used
652961	what does the swastika symbol represent germany suggests stands something
895263	what size hook for black sea bass surgery hold instrument tissue take used
653041	what does the term alien mean
938963	when did hugh glass die
653054	what does the term big elephant in the room mean part space patients hospital inside lodging
653092	what does the term extradite mean
915305	what type of work does caption call do?
653187	what does the term the age of aquarius mean?
391101	idiotsguides tai chi  involving controlled well-being movements designed discipline improve series
391125	ie import bookmarks
915544	what types of earthquake waves usually cause the most destruction? pressure temperature disturbance energy deformation point form transfers take intensity medium variation potential
129205	define wolff's law
129228	define workflow
129229	define workflow process
915762	what types of open surgery for inguinal hernia relating situated groin region part —called wall protrusion cavity organ enclosed tissue rupture is
915769	what types of organisms go through fermentation? life activities function means constituted living organs being carry individual
129491	define: dog's life
129517	define: entity's
391662	if meat is bad for you what should you eat
129641	define: morbid obesity disease relating characteristic characterized storage fat index indicated body adult mass accumulation is condition
129684	define: portrait
916186	what up siri?
129792	define: systemic system relating
129837	define: wrongful prosecution
130034	definition  moebius syndrome signs symptoms abnormality occur group characterize
392195	if you jammed your finger what to do hand digit forelimb members thumb terminating
654459	what does unesco stand for
392350	ifsc code hdfc koramangala
633375	what does bogue mean?
392393	ignis price in india
392488	iis post size limit residues blood activity stimulates composed amino angiotensin protein increases form pressure aldosterone chain is release death
654633	what does vaginal discharge mean care confinement custody release relating vagina resembling
392501	ikat fabric definition
633399	what does bond to jail mean? typhus
786477	what is presidential reserve with wyndham resorts something kept use stored need
916901	what vitamin deficiency causes mouth sores substances health vitamins shortage infection abraded ulcer body tissues sore ruptured spot
1070324	what is a mobile kitchen
917015	what vitamin is hard to absorb in our bodies take action pressure penetrated yielding substance plant organized living animal
917022	what vitamin is lacking in elderly women
808200	what is the best description of an adaptation adapted state adapting act being process
1070361	why is government necessary quizlet
655046	what does wearing a wedding gown in a dream mean? sleep images emotions REM thoughts occurring series
21793	are concierge medical fees tax deductible —often patient provider service rendered used payment
