1048585	what is paula deen's brother
2	 Androgen receptor define sense cells receives organ cell group stimuli
524332	treating tension headaches without medication —called cephalalgia pain head degree stretching act stretched action being stiffness condition deal means care
1048642	what is paranoid sc characterized resembling schizophrenia paranoid paranoia
524447	treatment of varicose veins in legs limb supporting animal walking body used prevent carry reflux walls blood branching flows presence vessels stream capillaries intervals have heart is hemoglobin arteries cases valves swollen dilated
786674	what is prime rate in canada
1048876	who plays young dr mallard on ncis immature offspring animals —used
1048917	what is operating system misconfiguration relating used operations
786786	what is priority pass
524699	tricare service number
1048995	who proposed the geocentric theory
786857	what is probability biology
524722	tricuspid atresia definition having cusps body absence passage closure
873886	what level does zubat evolves to
524733	trigeminal definition relating nerve
786918	what is process control equipment
786937	what is process improvement (lean six sigma) arsphenamine
1049085	what is on the outside of dna
262232	how long is a day on ven
524835	tristesse definition
524848	trivex lenses cost glass light rays plastic instrument eyeglasses focusing microscope image forming piece combined used
1049200	who recorded loving you
1049221	who recorded the song still the one?
1049329	what is nyu ranked
1049368	who s sherlock holmes cord number indicate region —used vertebra segment adie syndrome
787255	what is project charter in project management
262974	how long is a typical car loan? type conforming
1049456	what is nortriptyline prescribed for antidepressant administered form C19H21N·HCl hydrochloride give write prescriptions
1049774	cost of attendance eastern illinois university having Micrurus snake fulvius U.S. bands yellow hospital service
1049791	what is njstart
525534	turkey and china time difference drug symptoms cessation use undergoing withdrawal experienced
1288	3/5 of 60 isotope having —called gamma rays cancer number produced radium treatment mass reactors place radiography radiocobalt source used cobalt
1049894	who sang i feel wonderful tonight
787784	what is provocative allergy testing response reactivity exposure antigen hypersensitivity altered serving tending stimulate excite provoke
1049955	what is net gain
1050007	who sang louie louie louie louie
525779	twin tower adress birth pair born oxycephaly
263670	how long is flight from hyd to dubai
811852	what is the common name for jade
1576	60x40 slab cost
525868	two rivers supervisory union
306105	how much do jockeys have to weigh
1050231	what is nabumetone used to treat
1050253	who sang the song i had the time of my life
1050275	what is myrtus
526013	type of antibiotic is oseltamivir inhibit life tending prevent destroy drug phosphate B administered influenza form treatment C16H28N2O4·H3PO4 prevention A
263889	how long is if your on disability interferes engage participate activities function interactions limits tasks actions impairs ability person condition
788431	what is puritus ani fast
264150	how long is mount beacon
526331	types of anti depression medication alleviating acne symptoms
788484	what is purpose of sim card
1050670	who sing the song just swinging amount stimulus subject detect change level difference required stimulation
1050695	what is motor dyspraxia perform movements impairment ability
264284	how long is peak time for morphine —called flow expiration narrowing monitoring used measures lungs air asthma indicate forced device expiratory is rate meter capacity individuals C17H19NO3·HCl·3H2O hydrated sulfate C17H19NO3 form alkaloid crystalline opium base is used
1050747	who sings arabian nights aladdin
1050778	what is monological illusion presented image stimulus
2235	Bethel University was founded in what year
264410	how long is recovery from hemorrhoid banding returning state regaining act protrude used pain blood marked thrombosis tissue anus occurring itching vessels occurs be lead piles canal sphincter mass bleeding engorged involves procedure stomach band outlet pouch treatment empties obesity placing create remaining
788702	what is qa?
1050857	who sings c'est la vie music
437291	largest shipping day of year crowding bacteria synonym feedlots shipment pneumonia cattle marked distances Pasteurella conditions caused sheep occurs haemolytica virus Mannheimia is association disease fever
1050923	what is milk thistle useful in treating? flower receptacles including States United Silybum introduced silymarin purple marianum thistle been source is clasping has leaves heads Europe
526671	types of business entities existence disease something reality has condition
788851	what is qualfon
264594	how long is super bowl game
830531	what is the maximum yearly retirement contributions attained value quantity
1051095	who sings hey good looking
1051108	what is methylphenidate generic for attention stimulant C14H19NO2·HCl disorder administered system form treat narcolepsy deficit is hydrochloride
1051112	what is methanogens substrates taxon hydrogen ruminants production landfills carbon Methanobacteriaceae families archaea rice termites tract energy acetate sediments dioxide metabolism chiefly substrate methane found Euryarchaeota humans by-product environments paddies Methanosarcinaceae produce vents methylamine are anoxic use
789037	what is quillaia
1051211	what is mepap certification certified state act certifying being
1051214	what is meningitis.
1051223	what is menhir
1051229	what is memcached
1051257	what is megatron called
264827	how long is the flight from chicago to cairo
526984	types of coffee drinks mocha latte swallow imbibe
1051279	what is medjool dates
1051285	what is medicine acyclovir used for substance disease treating preparation used chicken pox nucleoside treat herpes shingles used C8H11N5O3
1051307	what is medical term for neck fusion? part vertebrate region body connects animal head
1051339	what is medical aki
1051352	what is mechanical advantages in science terms relating relations force matter
1051372	cost for child cineplex
2798	Does Suddenlink Carry ESPN3
1051422	what is mean streaming flowing instance cyclosis act
789292	what is radio miraya induced radio relating using frequencies
1051475	what is mca and get weekly paychecks fake?
789332	what is radiofrequency ablation? induced radio relating using frequencies
1051520	what is maxim
1051530	what is mastoidectomy bone cells removal process
2962	Explain what a bone scan is and what it is used for. vertebrate parts skeleton radiation device photometer sensing beam examine
1051571	what is marilyn manson music called
961705	when was the little prince book lished? 
1038859	what is the goddess of agriculture in greek mythology
1091234	proton pump used for what atom neutrons nuclei charge gram hydrogen nucleus electron has mass carries constituent is particle compresses device fluids suction attenuates transfers raises pressure gases
1051723	what is lone star trim ehrlichiosis back female Mountain birds spotted States genus United Rocky attacks mammals vector diseases A. adult is tick anaplasmosis has Amblyomma spot
1051755	who sings take this world by storm crisis increase disease symptoms
1051808	what is lmis
527568	types of ethnic foods list
1051886	who sings the song animals animals
1051902	what is lips lip articulations margin exposed membrane surround set mouth takes speech humans fleshy organs vertebrates folds composed pinkish opening are
527625	types of eyebrow shapes —called eye ridge brow growing hair
1051942	what is limericks
1051943	cost alternative to restasis relating medicine based
527769	types of flowering cactus bark dogwood Cornus been root C. has astringent genus used dried eaten part tithymaloides plant P. causes Pedilanthus poisoning is spurge genus
1052115	what is lemon party
527853	types of french fry cuts instrument penetrate
265729	how long keep financial records treatments patient history taken received results diagnoses care information medications test record
790059	what is rectocele?
1052274	what is korean seafood pancake characterized —called Korea hemorrhagic Asia symptoms virus Hantaan Manchuria fever fevers addition failure is caused Siberia
790178	what is reentry court involves held alternate explain tachycardia pathway impulse wave mechanism actions return depolarization resulting blocked transmission heart is abnormality
265960	how long nyquil kicks in
528117	types of honeysuckle
1052421	who starred in movie reckless?
1052427	who starred in north to alaska
838116	what is the origin of the word punk?
1052563	who stars in the tv show taken
1052585	what is john wayne real name
1091264	product level activity define function
1052615	what is jishuken
1052640	what is jelly in the us food made product fruit juice boiling sugar gelatin pectin
830812	what is the meaning of astute
1052717	who started the tesla car company weber meter mks square system density unit flux
1005595	when dividing what is the quotient ratio multiplied expected be measurement test depend score parts separate
1052948	who unified italy mazzini,garibaldi or cavour
568709	what are the dent dentistry dentist dental
1052965	what is ios devices mean function equipment mechanism perform designed serve purpose piece
1052985	what is ion plating on jewelry atom gained having charge lost result electrons group carries atoms dish cells microorganisms medium sample spreading
528760	types of metal plating dish cells microorganisms medium sample spreading
1053111	who voices steven universe lungs larynx means sound produced syrinx vertebrates beings
528841	types of mongooses animals
525047	trumbull marriott fax number
266760	how long should i boil corn on the cob? infection having —called follicle core skin tissue furuncle pus resulting forming swelling hair inflammation
1053219	what is insurance in law
1053253	what is institutional discrimination?
4696	Is the Louisiana sales tax 4.75
791140	what is respite
266920	how long should i slow cook ribs disease scrapie virus Creutzfeldt-Jakob caused cartilages pairs articulated column end bony walls body include mammals occur humans rods sternum connected vertebrates viscera protect region are stiffen
791223	what is restoril medication
529090	types of owls in nebraska
267012	how long should i wait to handle my ball python after feeding body round mass roundish bucket resembles body tissue shape handle being injury give food
529230	types of pin bone metal driven rod immobilize
4947	Ludacris Net Worth
1053611	what is in a chunky bar
830973	what is the meaning of e.g.
1053716	what is ibm chat characterized disability part absence —called anomalies mewing chromosome cry syndrome condition
568841	what are the differences with winter and summer summer diarrhea released quantity energy represents transfer involved electricity point difference unit points work potential
267341	how long should you allow a calf to nurse leg part knee fleshy
1053896	what is hyper-v heartbeat service pulsation heart
1053901	what is hydroxyz pam used for melphalan
1053931	what is hra and hsa serum albumin
1053992	who was first u.s president to resign from office
1053997	who was foreign minister molotov introduced body living situation occurring
267566	how long should you rinse your eyes in a safety eye wash action water liquid cleanse
791862	what is rinky dink
1054023	what is hold mail
791916	what is risk management? give example disease death possibility injury loss
568895	what are the different kinds of arthritis causes arthritis joints gouty condition inflammation
267644	how long should you wait in a walk in uses services patients appointment individual being providing
918424	what was grenfell
1054186	what is hdl is that good or bad cholesterol —called blood composed plasma triglyceride probability protein cholesterol developing lipoprotein atherosclerosis proportion associated is high-density
1054189	what is hcg for weight loss gonadotropin chorionic
529918	types of standards for frequency generators extent quality established something quantity weight authority measure set rule value objects classified number are individuals variations set attributes according class van generator
1054328	what is guarantee bond
792187	what is rohs testing
1054339	what is growth objective experience realm observers thought being relating object phenomenon condition
1093231	mandibular functions relating located
1054438	what is grievances
1054450	what is green soap used for made agent salts action cleansing emulsifying consisting sodium alkali acids fat potassium
1054451	what is green information technology
1054468	what is google doing in the cloud
5925	Sony PS-LX300USB how to connect to pc percent percentage
44686	average temp in hana hi hemagglutination inhibition
1054593	what is glass sightline
1054595	what is ginrou
1054610	who was john watson
1091163	racket define
1054707	what is gel in chemistry colloid form sol structure composition science properties deals substances transformations undergo
792595	what is rs medical definition? segment st
6217	The hormone that does the opposite of calcitonin is genders sexes used tends blood plasma calcium —called thyroid polypeptide lower thyrocalcitonin level hormone gland
1091337	price per month for hackett security
792688	what is rthdvbg
530572	types of wrist brace ligaments back paralysis appliance strained bone parts gives support muscles part hand region arm animal
792742	what is ruby used for
530601	types ofsexual disorder mayo
1054923	what is full recourse guaranty
1054958	what is freeroll in poker tournaments
1054969	what is freddie mac first look initiative macerate
792847	what is rustic italian food
1054999	what is framework in information
1055125	what is force fluids mean substance tending flow plant container body gas liquid conform outline animal
1055176	what is floxin otic ear located auditory region relating
1055197	what is flex fuel on a jeep? bend
1055351	who was richard nixon
531142	typing average words per minute test blood bacteria determine culture sample type time hour part degree
1091360	price of forever stamp now
1055505	continual define
793475	what is samsung defreeze code
831302	what is the meaning of nirvana
242713	how long can u keep fresh eggs for uracil
1055717	what is epic database for healthcare disease restoration dentistry psychology maintaining health treatment prevention noun hyphenated medicine professionals used
531490	uh uh definition
1215	3 levels of government in canada and their responsibilities promotes factor proliferation T cells stem produced differentiation stimulated antigen mitogen interleukin is
1055889	what is endocrinology clinic dealing endocrine science glands held serving case session patients instruction hospital studies bedside class
1093487	laws synonyms statement holding phenomena order known relation given conditions is
1055940	what is employee churn
531676	umeclidinium cost C29H34NO2·Br disease inhalation administered treat bronchodilator
1056057	what is electric baseboard heating become
1056060	what is elbaite
831380	what is the meaning of pound
1056163	what is eaglewood
1056211	constructivism education define
1056265	what is dry rot answers fungi bacteria decomposition action undergo
307118	how much do rear brakes and rotors cost
1056303	what is doxycycline hyclate used for treating infections treat tetracycline C22H24N2O8 used deal means care
166111	does excessive spinach consumption cause kidney stones body tuberculosis wasting
1056420	who was the hoosier poet
1056437	what is does un stands for
1056446	what is dockpanel used for
1056482	who was the last confederate soldier to surrender? neurocirculatory asthenia
7968	When did the earthquake hit San Francisco during the World Series
1056548	who was the lone survivor ehrlichiosis back female Mountain birds spotted States genus United Rocky attacks mammals vector diseases A. adult is tick anaplasmosis has Amblyomma spot remain existence live
270140	how long to cook sauerkraut and fresh kielbasa in slow cooker disease scrapie virus Creutzfeldt-Jakob caused
1056580	what is disease models pattern made something be cast cavity tooth
794469	what is sdna computer
1056644	what is diflorasone diacetate cream used for ester acetate groups derivative salt containing part milk percent butterfat containing
1056726	what is diagnosis of engineering signs disease symptoms art act identifying
1056758	what is depreciation of products
794625	what is secession
525660	turpentine slang meaning family brown obtained terebinth exudate oleoresin Pistacia yellow
1100134	are life insurance policies protected information?
1056850	who was the stig?
270422	how long to do rotisserie chicken
1056950	who was the woman who sang in wicked & rent?
270520	how long to fast before stress test
270521	how long to fast blood test
1057015	what is deck over on gooseneck trailers
270603	how long to fry okra
794893	what is selective media characterized tending select selecting selection relating
270642	how long to get a bachelors
1057098	who was was a ugandan dictator
1057112	what is datum target
1057139	what is database software? quizlet
1057168	who was yankee doodle
1057251	who were george washington's parents
1057270	who were marilyn monroe's friends
88831	causes of trigger finger in children point trigger hand digit forelimb members thumb terminating
8714	_____ is the name used to refer to the era of legalized segregation in the united states occurs genes meiosis separation
1057334	what is custom software
1057367	what is curosurf ?
533105	upstart meaning
8854	________ disparity refers to the slightly different view of the world that each eye receives.cyclopeanbinocularmonoculartrichromatic being information state received radiation part —called taken relation way body image oriented projection beam imaging
1057446	who were the founder of ibm lame go become
1057476	who were the hyksos people
1057488	who were the kings of denmark
1057539	what is crime rate for new port richey fl passage something be introduced opening channel body
569473	what are the effects of sediment transport liquid settles matter bottom
1057631	what is cplm
1057656	what is county mean
9083	____________________ is considered the father of modern medicine. power substitute influence father serves
533398	us army green beret training
1057708	confirmation number definition
569507	what are the eight steps of the troop leading process
1057757	who won ct election
1057937	confident man definition
1057996	what is considered the love apple
9454	a simple definition for the word bias.
1058036	what is considered human service experience
1058100	who wrote california dreaming have dream
795991	what is siam
1058140	who wrote creep
1058141	what is conjugated compounds union formed compound united
1058142	what is congenital sclerocornea? birth dating existing
1058165	who wrote dear john song
1058182	what is compressed air press squeeze
794665	what is secondary ptsd disorder stress occurrence development order
1058271	what is community legal service
1058325	what is collier investments inc cell covering part organism
1058415	who wrote jude the obscure
1058442	what is cmc program
1058470	what is clockspring
272075	how long to saute potatoes
1058515	what is cladribine
796383	what is simplicheck
831784	what is the meaning of the root shared by the words project and eject? weegy
534305	usaa home insurance phone number
1058601	what is chromosome coiling prokaryotes bacteria structures contain located material virus genes nucleus are organisms eukaryotes organism
1058604	what is chromium bro element combination found electroplating Cr —symbol used alloys
569674	what are the factors in a marketing mix? production result contributes something
220151	how do river otters see underwater?
10205	accelerated cml symptoms leukemia myeloid acceleration speed move cause undergo
1058792	computing definition
1058822	who wrote the book ninjago
10276	access, how to go to most recent record
1058885	what is causing the constant dry heaving and nausea remaining
10312	accordian definition
534617	userra definition
272500	how long to wait between perm and color
1058952	what is cataflam
1058978	who wrote the kentucky waltz
1059045	what is cameroon most important resource insurance system including RBRVS staff salaries malpractice takes payments practice treating done Medicare physicians account expenses work equipment patients overhead —abbreviation supplies
1059077	composite object definition senses something be material perceived
1094039	is qgenda a software
534941	usps schedule a delivery procedure sequence step program indicates regimen plan extraction membranes act parturition expulsion birth giving fetus
272815	how long until boiled eggs are done
1059253	what is buckyball
1059287	what is bst in blood test
1059420	what is boiled wool lanolin refining grease
1059421	what is body hives
535142	utm rounds made patients doctor hospital calls series nurse
1059442	who wrote when the levee breaks pieces snap fracture
273014	how long until you see gains from test e improve health
1059496	what is blue ice in a lake
1059504	who's billy bush?
11006	actress who plays alice on the magicians
1059601	what is block paintings
1059619	who's the killer bee africanized
11050	actress who turned down pretty woman & ghost twisting injure wrenching blood hemoglobin structure lost changes does cell has tissue stain
1059646	who's voice come from?
1059698	compare cost of dental implants set patterns consciousness habit
11133	acute myelogenous leukemia age number involved characterized blood cells body acute circulating animals according involves cause humans cell tissues organs is increase disease classified type marrow originating bone produced relating sensing perceiving
1059801	whos the third president of usa oculomotor nerve
273449	how long will cut melon stay good cavity joints tissue mass sometimes numbers instrument penetrate
535599	vanda orchids different leaf types tissue sheet layer
273481	how long will food last in the refrigerator without power
535627	vanguard wellesley income
273522	how long will heroin be detected in a urine test United made —called diacetylmorphine prohibited effects C21H23NO5 acetylation morphine use States is used diamorphine
1059970	why actuator is used
535743	varicose veins spiritual meaning prevent carry reflux walls blood branching flows presence vessels stream capillaries intervals have heart is hemoglobin arteries cases valves swollen dilated
1060039	what is beverly hills md
1060040	what is betts
176677	during pregnancy, when does the baby get in the head down position procedure body parts location considered arrangement
1094191	is common law marriage legal in what states address counseling problems therapy designed relationship couples
812190	what is the constitution act 1867
1060305	why are clouds flat at the bottom characterized peaks tracing depressions being line
1060342	what is battery life f farad
1060391	what is barbra streisand net worth
798253	what is southwest airlines baggage policy
798284	what is soya foods soybean
1060462	what is baking chocolate sodium bicarbonate
1094249	is a type of information system that supports a specific functional area in the organization (such as: accounting, human resources or operations) being function connected restricted nature effect relation situation individual hold foundation serve prop
11913	advanced aerospace engineering salary space personnel health problems atmosphere concerned earth flight specialty
1060496	what is badger inc in penn yan ny
274067	how lubrication proximity switch work appearance make slippery action motion
1060566	community bank bristow routing number
274175	how many 1000 in 1 million calcitriol
1060616	why are junction mounts needed for cameras place meeting point camera substance record radionuclide scanning produced injected body detects decay create photons is used
1060623	what is baby boomers means
536480	verrucous lesion verrucose one part disease structure circumscribed organ change defined injury is
1060795	what is average wet bulb temp marked fluid secretions abundance effusions presence something enlargement expansion dilation base
1006922	which chromosome controls sex characteristics structures basis species occur forms are individuals distinguished male organs quality trait property incorporate controls prokaryotes bacteria structures contain located material virus genes nucleus are organisms eukaryotes organism
570023	what are the four most commonly used metric prefixes system relating using
262280	how long is a dogs heat cycle?
1060868	what is average roi for advertising
1060881	what is average pay for a warrant officer?
613727	what county is toledo oh in?
536654	vestibular hypofunction definition endocrine function decreased gland sense ear system relating vestibule nerve vestibular
45757	average temperatures des moines iowa diethylstilbestrol
482666	prohibition defdinition
798883	what is spoofing in the context of it?
1091545	poct meaning
536791	viable meaning? having be surviving form living attained development uterus
798945	what is spotting amounts uterus experience bleeding
570068	what are the four steps in the machine cycle
1004258	when he was born ben franklin
1061167	what is at the base of the aorta blood be body arteries carries branch distributed heart trunk
