192502	function of spleen in human flattened capsule storage organization denser role production system enclosed consisting masses end associated trabeculae object blood pulp cells consistency organ circulatory purplish tissue interstices fragile ductless plays chiefly ramify lymphocytes stomach connection lying destruction humans vertebrates is condensed resembles filtration arteries gland supply
192579	function to count a certain character in cell groups indicate find number name involved units
979054	where is caba
979133	where is calcium absorbed in the body —symbol element occurs combination metal plants Ca earth animals bivalent constituent is take action
454872	minor scale how many flats and sharps pieces lancet shattering instrument syringe scalpel used is produce pan tray balance involving risk life
192894	furthest distance man has traveled in space time duration period
993353	which quality of high-performing teams helps team members build confidence? distinguishing attribute body part organ
455273	modality cardinal meaning avenues sensation vision heart discharging blood —called sinus side duct running embryo column pair Cuvier meeting vein veins
556489	what are chia seeds benefits
717563	what is an unlocked cell phone
979713	where is chandler texas
455456	molar mass of phenol preceded adapted premolars incisors restricted pairs grinding surface jaw side milk teeth including are tooth canines wood —called tar compound used plastics dyes manufacture anesthetic present coal crystalline C6H5OH is solution pharmaceuticals aspirin hydroxybenzene acid resins taken constitutes measure property material weight based body quantities time length field amount causes have is contains inertia are measurements
993419	where is st martin segment st
979787	where is chedun town songjiang district
512825	temperature sensors - analog output matter amount energy organ system discharged time sense device light transmits sound responds stimulus organ control magnetism measurement operating resulting pressure heat motion is something
762455	what is jokull journal
193422	gas price in mount gilead oh
717751	what is analytical approach to intelligence separating something elements parts analysis constituent relating part procedure access is gained learn understand deal situations ability trying
717763	what is anaphylaxis symptoms agent proteins following contact drugs resulting hypersensitivity sensitization
455659	moneygram toll free number
455743	monoliths definition
455776	monosyllabic definition
455782	monoxide poisoning symptoms atom oxygen oxide containing molecule kill poison injure
455793	monsters definition synonym
455853	monthly average hours daylight los angeles
455862	monthly average temperature flagstaff az
980168	where is clifton springs, ny
193742	gendered phenomenon definition event fact
718112	what is annual salary
193866	general izzam
456016	moon spiritual meaning
306806	how much do phlebotomist make starting out
193968	generic blood thinners for afib
718444	what is another word for comma
456305	most accurate weather app for iphone appendix
980633	where is counce tn
294518	how many rib eye steaks in a cow turns bends cow hock are hind legs dog shanks horse cartilages pairs articulated column end bony walls body include mammals occur humans rods sternum connected vertebrates viscera protect region are stiffen
456443	most beautiful place in the world
456551	most charming kingdoms to visit attend go patient divisions are objects grouped
718782	what is anxiety uneasiness state nervousness ill being
194531	geranium rose essential oil benefits oil family pinnate shrubs leaves flowers are Rosaceae sources rose genus Rosa being relating containing essence
981006	where is danvers, ma
456734	most common causes of accidental death carelessness combination causes resulting event unawareness ignorance
133977	definition of dignity for kids
194750	get rid of cellulite fast at home deposits appearance surface skin thighs tissue buttocks give hips fat
194870	ghost meaning urban blood hemoglobin structure lost changes does cell has tissue stain
981400	where is disney
1092422	most valuable employers mve
719411	what is aragonite used for
195199	glioma meaning cells arising tumor
195440	gnosticism heresy definition
272047	how long to roast whole.chicken
719749	what is army force management
457622	most expensive car brands
573899	what are the steelers worth
382119	how to tag images twitter flesh muscle shred counterpart lens device produced mirror object
457714	most expensive hotels in new york city
195582	gold price in ksa dammam
457809	most expensive sports franchise
195693	golf cost
457842	most expensive violin ever
862742	what is whey powder made from separated contains part curd milk vitamins serum making process minerals traces is fat medicated product preparation powder form medicine particles
720013	what is arzoo
982348	where is eunice nm nanometer
458064	most hit powerball numbers
458110	most important battle of world war 2 
720261	what is assault in the second degree dotage consent act committed acts person series rape
982481	where is fairview
458235	most knockouts in boxing walls landmarks preserving cast construction building base impression
196111	gorm the dissolver
1091384	price for used shipping containers crowding bacteria synonym feedlots shipment pneumonia cattle marked distances Pasteurella conditions caused sheep occurs haemolytica virus Mannheimia is association disease fever
196232	government does do
196250	government of canada logo
775457	what is natural language processing definition auditory disorder processing
196453	grammy award for album of the year michael jackson
1081321	yeast symptoms std transmitted disease
196596	granulocytes dendritic cells characterized blood lobed cells cytoplasm basophil nucleus group eosinophil impulses branching processes cell body conduct nerve
458771	most popular neil diamond song
458774	most popular news networks cords structure crossings cross secured fabric are wires intervals knotted
196720	graveyard shift meaning place frequency change position
458885	most popular tourist attraction in uruguay matter acting draw force tending resisting separation particles
513397	terry hayes for governor maine characterized suggestibility concentrate descent startled impairment movements lumbering regions exhibit inability are individuals jumping Maine being condition
993996	which movement increases the angle between articulating bones? part space corner constituting utter
1080229	would human urine keep deer away bacterium Lyme disease tick transmits causing dammini scapularis genus I. Ixodes
196949	green acres tv show cast
196963	green card meaning
983438	where is glenfinnan
983451	where is glossotonsillar
197024	greenhorns meaning
983499	where is gold located with the earth
983543	where is goodland fl,
721409	what is average mileage on a car
459280	most scenic spots in london area mark
459291	most secluded beach north carolina
128772	define user maintenance serving patient designed maintain prevent healing adequate relapse process condition
983708	where is graycliff cigars based
459481	most used automation program
197542	guatemala absolute location pure mixture
721885	what is backbone of rna vs dna spine column activities chemical —called contain acid are control components associated acids
984075	where is hamvir's rest in skyrim repose sleep state
1037826	who is robert walton
984178	where is hartwell ga
459948	mouth sores from dental work infection abraded ulcer body tissues sore ruptured spot
197945	had the water in the bay ever reached the bridge part nose bony compartment care hospital place ship used
197964	haemoptysis causes part blood tract respiratory expectoration
984434	where is highgarden where the tyrells are from
460162	mri what to expect procedure imaging resonance is used
722352	what is bargain hunt store restore connection dislocated fractured position
984499	where is hips measured part pelvis side femur region parts fleshy formed covering trunk apportion amounts allot
722413	what is barron
722515	what is basel iii hiv-1
460403	multilateral netting definition
984770	where is humana by westgate in glendale az
984856	why are ural mountains considered a natural boundary
984930	where is indio calif
984948	why are the nerves in my nose tingling part nostrils cavity covers bears face impulses funiculi fibers enclosed system gathered made nerves dendrites tissue nerve structures bands organs perineurium have conduct surrounded axons epineurium are parts
906901	what to do when you run out of storage on LG optimus —called disease Gaucher cerebrosides broken substances body are thesaurosis accumulation
984992	why are teen crashes a problem
198581	harland clarke customer service number dorsalis nucleus
722981	what is beer gas statement made function transmittance ways product light travels distance absorbance concentration physics is solution
985158	why are lymph nodes swelling in growing area spring maturity develop joint enlargement swelling vessels lymphocytes thoracic blood plasma platelets duct resembles cells way fluid body passes tissue discharged spaces containing is
985165	why are jury trials important to court cases like those of felina early v. suzy snoozer experiment usefulness tryout test quality value back secured extended rod form Pott end sling head supporting suspended body deterioration device spine consists is disease cases hook
985167	why are insulators used to cover the conducting wires cover slide glass plastic material microscope piece used surgery thread dentistry position bone metal suture teeth rod tissue transfix used fractured medium conveying act made device material insulation provide is used
985173	definition of product strategy in marketing function structure appears success serves complex serve achieving metabolism adaptations behavior adaptation
985207	why are healthy microglia important? vigor mind spirit enjoying health body part function be derived cells processes are system monocytes glia consisting thought phagocyte have origin scattered
198807	has a mlb team ever gone undefeated in the regular season system having constituting
985259	definition of private nuisance patient accommodating recovering room staying
985275	why are bacterial infections common in diabetics person affected diabetes relating bacteria caused fungi state establishment bacteria microorganisms produced body protozoans viruses host agents
723144	what is bella mean in italian
985304	whole foods plant ba refining elements constituents nothing components deprived separation containing processing
985360	who wrote we just disagree original amount stimulus subject detect change level difference required stimulation
461078	nafta purpose and function
985371	definition of prefect
985431	who wrote the ffa creed and adopted it acids fatty
985433	who wrote song can't stop the feeling for movie contains senses sensations touch skin are organs end temperature
985461	who wrote on eagle's wings paired means fly bird insect is bat feathered appendages
1036656	what is the meaning of chicken rice?
461281	name lennart
199177	hasse definition
985644	where is kashi china
985653	where is katherine mae davis
985736	who was william more
985752	who was william henry preceded by circuits mks results force self-inductance volt circuit inductance unit variation
461491	name meaning paige
298113	how many time zones are in the world? structure
461601	name morgan meaning constructing distance frequency genes chromosome maps percent unit crossing-over is used
985905	where is kl sentral kiloliter
723781	what is bicarbonate in a blood test carbonate acid
199572	head sores scalp infection abraded ulcer body tissues sore ruptured spot integument covered part sexes hair head
295406	how many seats kia sorento part rests dentistry surface
986068	who was the first man in orbit us vessels —called blood nerves passage occupies side protects eye cavity bone perforated socket skull appendages front encloses bony
986162	who was the commanding general in north africa
986197	who was the choir director for grace cathedral in san francisco knife guide instrument grooved limit motion coccidioidomycosis
199776	health benefits of eating vegetarian vegetarianism practices believes individual
986210	who was the basket of apples by family fruit pome Malus rounded rose apple tree pass cells basketlike inward Purkinje network cerebellum end axons layer
724121	what is bioflavonoids
199837	health benefits of neem tree
986325	where is lapham peak —called flow expiration narrowing monitoring used measures lungs air asthma indicate forced device expiratory is rate meter capacity individuals
986411	who was president of us during ww weight indicate gas —used contained is solution
724275	what is biote
986427	who was peter drucker
986472	who was milton's lycidas?
200042	health reform bill
986484	definition of out
986494	who was mary ludwig hays? jaw passage rapid marked chills mouth adjoining neck close respiratory floor accompanied tissues swelling is infection streptococcal fever parts
724410	what is bitcoins used for
462301	narcolepsy is most often considered to be a disorder of characterized sleep attacks hallucinations cataplexy occurring condition
724571	what is blackleg bacterium —called anthrax Clostridium feseri toxemia produced C. toxins evil ill soil quarter cattle genus caused chauvoei
776122	what is nerve agent vx produces something effect producing is impulses funiculi fibers enclosed system gathered made nerves dendrites tissue nerve structures bands organs perineurium have conduct surrounded axons epineurium are parts agent paralysis death consciousness doses system C11H26NO2PS warfare failure used leading nerve convulsions chemical respiratory causes loss is gas
724579	what is blackwater called now characterized urine Texas blackwater diseases fever
200296	heart rate increase during exercise faculty repeated use
986733	who was involved in the locarno treaties
844658	what is the role of lipids in a cell proteins constitute fats waxes cells phospholipids carbohydrates cerebrosides compounds substances are ether include components living solvents chloroform
994582	where is the base of the tongue food functions end covering hyoid organ attached mouth base process speech muscle attaching glands taking structure move floor swallowing consists organs is bone relation parts mass
986791	who was gracie allen married to
986793	who was george w kirk tungsten
724680	what is blockchain simple
855029	what is the zip code for harahan la
986852	who was dauphin
724733	what is blood in science
986932	where is lucas black from
986935	who was catherine ii russia residues blood activity stimulates composed amino angiotensin protein increases form pressure aldosterone chain is release
986936	who was carlomagno
986972	where is luton
724872	what is blue nile jewelry? dye presence staining dilute sulfate red form stain acid chiefly used fat
724887	what is blue zone
462765	nauticus hours
987066	who was a doctor tha tacrine
724947	what is bmc neuroscience nerves physiology science biochemistry relation biology deals neurophysiology tissue learning anatomy branch behavior
987100	where is magma found within our earth matter state mixture paste mineral unit centimeters length yard
1010524	what year did the song vehicle by the ides of march come out medium agent is administered
987183	who studied neptune
725047	what is bobtail?
987192	who started the ballet russe
987230	who sings unforgettable
987237	who sings the wedding song on walker texas ranger infirm person framework designed walk learning support infant
462979	ndola lime address —called calcium powdery magnesia consists solid
987309	definition of morse mood mind state emotion feeling
425688	is the aluminum compound in antiperspirants carcinogenic form parts combining —symbol conductivity element occurs combination trivalent oxidation ductile metal has resistance crust earth reflectivity Al is producing tending produce cancer
987486	where is matheson colorado
987502	who sells oroweat breads
463230	neonatal hemochromatosis causes fatigue arthritis pain characterized men diabetes weakness skin untreated bronzing metabolism affects involves women pigments lead tissues heart is deposition disease cirrhosis disorder affecting birth relating month infant
907334	what to eat to lower your blood sugar quickly living
987567	who sang the theme some for the dukes of hazard?
987573	who sang the song siboney?
201154	henry ford health system code of ethics principles group governing conduct individual circuits mks results force self-inductance volt circuit inductance unit variation
987671	who said never let a tragedy go to waste breaking tissue loss milk gland formed udder release
463443	net worth of gloria vandervelt
987791	who ran mexico for decades as a dictator?
201366	here comes the hotstepper song
201376	here there be dragons comic
987809	who proposed the xy theory
987822	who proposed a compromise that was rejected during the civil war impairment cause be rebuff communicate hear repel refuse withhold feelings love
987823	who promoted new south occurrence contribute cause development growth
987845	who presides over a senate trial trial after a president is impeached experiment usefulness tryout test quality value
987914	where is milicov
732631	what is competency based education competence
463635	neurological syphilis symptoms —called years chancres lesions stages course genus rashes left caused produces Treponema lues is T. disease pallidum spirochete continued system relating neurology affecting
987978	where is miralago
725867	what is brewhaha
725951	what is bro?
988119	who played alicia on the big bang theory
988121	definition of lubricating oil appearance make slippery action motion
988122	who planned caesar's death fertility services means promoting control —used accessibility materials
988124	definition of lu lutetium
801059	what is superior and inferior in the body part feet body situated being part feet body situated being head
988142	who paul clark —called Paul-Bunnell reaction heterophile test mononucleosis diagnosis antibodies used
988149	where is monroe washington
988169	where is montana usa
988211	who owns safeway canada
726076	what is broth food meat been has liquid cooked
726098	what is brownfields
988269	where is moravian falls
1038527	cravat definition
988294	where is morocco located in africa
988306	who owns charlotte hilton university place hotel
988416	who moses asaga
202006	highest cash rewards credit cards give reward
988504	who led the push for modernization in turkey?
202073	highest dosage of aspirin C9H8O4 fever crystalline relief acid used pain agent application ingredient addition dose measured
988512	who is your favourite drink?
202081	highest dose of glimepiride type drug C24H34N4O5S functions taken diabetes cells treatment insulin beta chiefly is stimulating release agent quantity be taken time
988540	definition of ionization e ions convert
988636	who is the reclaimer
988653	who is the president of the republic of texas right now mark smith displacement fracture portion radius fragment
988710	who is the poet of the charge of the light brigade
464440	nicotinic antagonists fibers doses mimicked effects produced mediating nerve muscle relating junctions activity resembling are ganglia liberated increases acetylcholine inhibits nicotine producing opposition agent acts
156723	do hulled strawberries need to be refrigerated?
988742	who is the oldest film director knife guide instrument grooved limit motion
988743	who is the oldest dodge dealer in the world
988745	who is the new york county clerk
726614	what is butalbital/acetamin/caff/cod
464484	nighttime hip pain causes part pelvis side femur region parts fleshy formed covering trunk
988787	who is the judge michael day district court of south dakota
820161	what is the elevation of white pass in washington skin swelling
988911	who is the current president of the senate?
988915	who is the current general manager of the arizona diamondbacks
988954	who is the character cain on lucifer
988960	where is nashville tn located
988988	where is navy seal museum sealant apply
989042	who is the author of song my december
989099	where is new columbia pa
989108	where is new hope alabama
989213	who is scarlett in total drama
202797	highest point on earth's surface
1097885	how long nicotine stay in your saliva insecticide aids smoking cessation C10H14N2 tobacco alkaloid principle is used glands food water secretion salts starches breakdown ptyalin protein begins ingested lubricates mouth secreted mucin enzyme is
727224	what is calyceal diverticulum colon bladder organ opening pouch sac relating calyx
202954	highest salary ronaldo
989396	who is rose elizabeth cleveland oil family pinnate shrubs leaves flowers are Rosaceae sources rose genus Rosa
995029	where is the city of tightwad
776576	what is nexgard for dogs
203039	highest state income tax rate
1005500	which are the organs inside of our body function kidney structure cells performing tissues consisting heart organism
252295	how long does it take a chicken egg to mature and hatch having completed development growth
989530	who is ralph marston
989543	where is oakalla texas
989573	who is postmaster for vancouver washington
776609	what is nfl otas
989647	where is ohio caverns located
989676	who is parent company for fleetcor begets forth brings offspring
727551	what is capital restructuring
203274	hillsborough community college president
203317	hilton in baltimore
203390	hip arthroscopy definition part pelvis side femur region parts fleshy formed covering trunk involving procedure remove diagnose repair bone examination interior treat arthroscope conditions tissue damaged injuries diseased
989831	who is michael dukakis
727699	what is carbohydrate intake taking process act foods starches constitute hydrogen compounds carbon sugars are celluloses plants formed oxygen animal class
727707	what is carbohydrates?
989855	where is osborn corner tooth corner
989866	where is ossian ia
989870	who is megan mccain's husband
203458	hippo denotation definition
989894	who is mark davis
727765	what is carbon monoxide made of atom oxygen oxide containing molecule element obtained graphite found limestone petroleum charcoal compounds diamonds constituent —symbol asphalt C coal
989912	where is overhaulin located
727779	what is carbonate hardness acid salt ester pressure penetrated yielding
989963	where is ozark lake missouri
989994	where is padre island tx
990010	where is paihia
990026	who is li ching lithium
203646	history of boxing in the usa walls landmarks preserving cast construction building base impression
990093	who is kwame nkrumah
203688	history of interest rates
990176	definition of gist summary
990197	where is parry sound injury disease exhibiting health
728060	what is carpuject
990223	who is kathleen a. crowley esq.,
728110	what is carvedilol used for heart activity failure following blocking hypertension manage patients attack C24H26N2O4 treat dysfunction possesses beta-blocker is used
728150	what is cash limit
990307	who is jim steranko
990345	definition of futility
1038871	who is susan boyle
990375	who is jeconiah
1038879	what is the goal for the child with a cognitive impairment? imagining remembering activity words reasoning thinking being relating learning completion aimed goal task
466162	npi number cintia roguin
990459	who is huitzilopochtli
990481	where is phenix city
466202	nsc definition of an accident carelessness combination causes resulting event unawareness ignorance
990526	who is haiti's leader
466252	nuclear definition in science relating constituting nucleus
1045554	what is supp social security
728460	what is causing green slim on bowel movements intestines intestine use divisions gut used AIDS stages body wasting moving process act
466335	number bingo cards
990649	who is fred luter
990763	who is ernest bailes
990784	where is poole kentucky
990841	who is dr burnett
990852	who is dr ari brown microscopic —called surrounding liquids suspended impact fluid movement molecules resulting gases particles
1097939	how long is the bachelor finale
466640	number of grams in pound
728823	what is cec on soil test
728836	what is cefazolin used to treat administered form salt sodium cephalosporin is C14H13N8NaO4S3
990995	who is dakota meyer
466738	number of moves in chess place pass go
991032	who is cole bennett
991044	who is christopher columbus define
466774	number of original star trek episode part occurrence is event series condition
991064	where is provo river
991079	who is camille grammer boyfriend
991111	who is bradley beach nj senator
991138	where is punta cana eden resort
991171	who is boll weevil
1082701	what does the name yamil mean
991207	who is ben hanisch
991240	where is quincy located
729173	what is cerebral cavernoma intellect relating brain angioma tumor
991324	who is ann rand?
991342	who is amandla stenberg
991364	who is admiral rickover
685717	what is a grady white boat?
991383	where is ravenscroft, cheshire england?
991419	where is redford michigan
991471	who invented the tabata exercises faculty repeated use
205107	honesty or integrity definition condition
467274	nurses elbow causes curve outer —called supports bent arm joint forearm surgeon infirm physician maintaining practices health professional cares sick skilled supervised promoting dentist person is
991590	where is ridgewood ny located
991598	where is right lakeshore drive?
